{
  "schemaVersion": 1,
  "datasetId": "dsh-memory-retrieval",
  "datasetVersion": "1.0.0",
  "referenceCommit": "dc000a4877538b193a51444e890fe552147ffa9f",
  "evaluationTime": "2026-08-20T00:00:00.000Z",
  "corpora": [
    {
      "id": "shared-retrieval-corpus-v1",
      "records": [
        {
          "id": "mem-synonym-zh-cinema",
          "owner": { "tenantId": "tenant-alpha", "userId": "user-main", "agentId": "assistant-main" },
          "sourceSessionId": "session-profile-zh",
          "layer": "l4_identity",
          "content": "用户偏爱悬疑推理电影。",
          "tags": ["观影", "偏好"],
          "status": "active",
          "visibility": "recallable",
          "sourceType": "explicit",
          "confidence": 0.95,
          "createdAt": "2026-08-01T00:00:00.000Z",
          "updatedAt": "2026-08-01T00:00:00.000Z",
          "revision": 1,
          "relations": { "supersedes": [], "supersededBy": [], "consolidates": [], "sourceMemoryIds": [] }
        },
        {
          "id": "mem-synonym-en-cinema",
          "owner": { "tenantId": "tenant-alpha", "userId": "user-main", "agentId": "assistant-main" },
          "sourceSessionId": "session-profile-en",
          "layer": "l4_identity",
          "content": "The user enjoys speculative fiction films.",
          "tags": ["cinema", "preference"],
          "status": "active",
          "visibility": "recallable",
          "sourceType": "explicit",
          "confidence": 0.94,
          "createdAt": "2026-08-01T00:01:00.000Z",
          "updatedAt": "2026-08-01T00:01:00.000Z",
          "revision": 1,
          "relations": { "supersedes": [], "supersededBy": [], "consolidates": [], "sourceMemoryIds": [] }
        },
        {
          "id": "mem-pronoun-zh-wutong",
          "owner": { "tenantId": "tenant-alpha", "userId": "user-main", "agentId": "assistant-main" },
          "sourceSessionId": "session-team-zh",
          "layer": "l2_fact",
          "content": "林岚负责梧桐项目的后端服务。",
          "tags": ["梧桐", "职责"],
          "status": "active",
          "visibility": "recallable",
          "sourceType": "explicit",
          "confidence": 0.96,
          "createdAt": "2026-08-01T00:02:00.000Z",
          "updatedAt": "2026-08-01T00:02:00.000Z",
          "revision": 1,
          "relations": { "supersedes": [], "supersededBy": [], "consolidates": [], "sourceMemoryIds": [] }
        },
        {
          "id": "mem-pronoun-en-atlas",
          "owner": { "tenantId": "tenant-alpha", "userId": "user-main", "agentId": "assistant-main" },
          "sourceSessionId": "session-team-en",
          "layer": "l2_fact",
          "content": "Maya Patel leads the Atlas service migration.",
          "tags": ["atlas", "ownership"],
          "status": "active",
          "visibility": "recallable",
          "sourceType": "explicit",
          "confidence": 0.96,
          "createdAt": "2026-08-01T00:03:00.000Z",
          "updatedAt": "2026-08-01T00:03:00.000Z",
          "revision": 1,
          "relations": { "supersedes": [], "supersededBy": [], "consolidates": [], "sourceMemoryIds": [] }
        },
        {
          "id": "mem-multi-zh-launch",
          "owner": { "tenantId": "tenant-alpha", "userId": "user-main", "agentId": "assistant-main" },
          "sourceSessionId": "session-northstar-zh",
          "layer": "l2_fact",
          "content": "北极星项目的发布日期是十一月十二日。",
          "tags": ["北极星", "发布"],
          "status": "active",
          "visibility": "recallable",
          "sourceType": "explicit",
          "confidence": 0.98,
          "occurredAt": "2026-11-12T00:00:00.000Z",
          "createdAt": "2026-08-01T00:04:00.000Z",
          "updatedAt": "2026-08-01T00:04:00.000Z",
          "revision": 1,
          "relations": { "supersedes": [], "supersededBy": [], "consolidates": [], "sourceMemoryIds": [] }
        },
        {
          "id": "mem-multi-zh-editor",
          "owner": { "tenantId": "tenant-alpha", "userId": "user-main", "agentId": "assistant-main" },
          "sourceSessionId": "session-northstar-zh",
          "layer": "l2_fact",
          "content": "北极星团队使用Zed编辑器开发后端。",
          "tags": ["北极星", "编辑器"],
          "status": "active",
          "visibility": "recallable",
          "sourceType": "explicit",
          "confidence": 0.97,
          "createdAt": "2026-08-01T00:05:00.000Z",
          "updatedAt": "2026-08-01T00:05:00.000Z",
          "revision": 1,
          "relations": { "supersedes": [], "supersededBy": [], "consolidates": [], "sourceMemoryIds": [] }
        },
        {
          "id": "mem-multi-en-launch",
          "owner": { "tenantId": "tenant-alpha", "userId": "user-main", "agentId": "assistant-main" },
          "sourceSessionId": "session-northstar-en",
          "layer": "l2_fact",
          "content": "Project Northstar ships on November twelfth.",
          "tags": ["northstar", "release"],
          "status": "active",
          "visibility": "recallable",
          "sourceType": "explicit",
          "confidence": 0.98,
          "occurredAt": "2026-11-12T00:00:00.000Z",
          "createdAt": "2026-08-01T00:06:00.000Z",
          "updatedAt": "2026-08-01T00:06:00.000Z",
          "revision": 1,
          "relations": { "supersedes": [], "supersededBy": [], "consolidates": [], "sourceMemoryIds": [] }
        },
        {
          "id": "mem-multi-en-editor",
          "owner": { "tenantId": "tenant-alpha", "userId": "user-main", "agentId": "assistant-main" },
          "sourceSessionId": "session-northstar-en",
          "layer": "l2_fact",
          "content": "The Northstar backend team develops with the Zed editor.",
          "tags": ["northstar", "editor"],
          "status": "active",
          "visibility": "recallable",
          "sourceType": "explicit",
          "confidence": 0.97,
          "createdAt": "2026-08-01T00:07:00.000Z",
          "updatedAt": "2026-08-01T00:07:00.000Z",
          "revision": 1,
          "relations": { "supersedes": [], "supersededBy": [], "consolidates": [], "sourceMemoryIds": [] }
        },
        {
          "id": "mem-noise-zh-northstar-budget",
          "owner": { "tenantId": "tenant-alpha", "userId": "user-main", "agentId": "assistant-main" },
          "sourceSessionId": "session-northstar-noise-zh",
          "layer": "l2_fact",
          "content": "北极星项目的发布预算由财务团队审核。",
          "tags": ["北极星", "发布", "团队"],
          "status": "active",
          "visibility": "recallable",
          "sourceType": "explicit",
          "confidence": 0.9,
          "createdAt": "2026-08-01T00:08:00.000Z",
          "updatedAt": "2026-08-01T00:08:00.000Z",
          "revision": 1,
          "relations": { "supersedes": [], "supersededBy": [], "consolidates": [], "sourceMemoryIds": [] }
        },
        {
          "id": "mem-noise-en-northstar-budget",
          "owner": { "tenantId": "tenant-alpha", "userId": "user-main", "agentId": "assistant-main" },
          "sourceSessionId": "session-northstar-noise-en",
          "layer": "l2_fact",
          "content": "The finance team reviews the Northstar project launch budget.",
          "tags": ["northstar", "launch", "team"],
          "status": "active",
          "visibility": "recallable",
          "sourceType": "explicit",
          "confidence": 0.9,
          "createdAt": "2026-08-01T00:09:00.000Z",
          "updatedAt": "2026-08-01T00:09:00.000Z",
          "revision": 1,
          "relations": { "supersedes": [], "supersededBy": [], "consolidates": [], "sourceMemoryIds": [] }
        },
        {
          "id": "mem-current-zh-codename-old",
          "owner": { "tenantId": "tenant-alpha", "userId": "user-main", "agentId": "assistant-main" },
          "sourceSessionId": "session-codename-old-zh",
          "layer": "l2_fact",
          "content": "曙光部署计划的代号是朱雀。",
          "tags": ["曙光", "代号"],
          "status": "superseded",
          "visibility": "source_only",
          "sourceType": "explicit",
          "confidence": 0.95,
          "createdAt": "2026-07-01T00:00:00.000Z",
          "updatedAt": "2026-08-02T00:00:00.000Z",
          "revision": 1,
          "relations": { "chainId": "chain-current-zh-codename", "supersedes": [], "supersededBy": ["mem-current-zh-codename-new"], "consolidates": [], "sourceMemoryIds": [] }
        },
        {
          "id": "mem-current-zh-codename-new",
          "owner": { "tenantId": "tenant-alpha", "userId": "user-main", "agentId": "assistant-main" },
          "sourceSessionId": "session-codename-new-zh",
          "layer": "l2_fact",
          "content": "曙光部署计划的当前代号是玄武。",
          "tags": ["曙光", "代号", "当前"],
          "status": "active",
          "visibility": "recallable",
          "sourceType": "explicit",
          "confidence": 0.99,
          "createdAt": "2026-08-02T00:00:00.000Z",
          "updatedAt": "2026-08-02T00:00:00.000Z",
          "revision": 2,
          "relations": { "chainId": "chain-current-zh-codename", "supersedes": ["mem-current-zh-codename-old"], "supersededBy": [], "consolidates": [], "sourceMemoryIds": [] }
        },
        {
          "id": "mem-current-en-codename-old",
          "owner": { "tenantId": "tenant-alpha", "userId": "user-main", "agentId": "assistant-main" },
          "sourceSessionId": "session-codename-old-en",
          "layer": "l2_fact",
          "content": "The Aurora deployment plan used the codename Ember.",
          "tags": ["aurora", "codename"],
          "status": "superseded",
          "visibility": "source_only",
          "sourceType": "explicit",
          "confidence": 0.95,
          "createdAt": "2026-07-01T00:01:00.000Z",
          "updatedAt": "2026-08-02T00:01:00.000Z",
          "revision": 1,
          "relations": { "chainId": "chain-current-en-codename", "supersedes": [], "supersededBy": ["mem-current-en-codename-new"], "consolidates": [], "sourceMemoryIds": [] }
        },
        {
          "id": "mem-current-en-codename-new",